{
  "$schema": "https://json-schema.org/draft/2020-12/schema",
  "title": "regions/<slug>/region.json",
  "description": "지역 설정: 화면 제목, 시작 위치, 지역 코드, 지구, 출처, 상태 순서.",
  "type": "object",
  "required": [
    "schema_version",
    "slug",
    "name",
    "title",
    "updatedAt",
    "view",
    "codes",
    "zones",
    "sources",
    "statusOrder"
  ],
  "additionalProperties": false,
  "properties": {
    "schema_version": {
      "$ref": "#/$defs/semver"
    },
    "slug": {
      "type": "string",
      "pattern": "^[a-z0-9]+(-[a-z0-9]+)*$"
    },
    "name": {
      "type": "string"
    },
    "title": {
      "type": "string",
      "description": "화면 제목"
    },
    "description": {
      "type": "string"
    },
    "updatedAt": {
      "type": "string",
      "format": "date"
    },
    "view": {
      "type": "object",
      "required": [
        "center",
        "zoom"
      ],
      "additionalProperties": false,
      "properties": {
        "center": {
          "$ref": "#/$defs/lonlat"
        },
        "zoom": {
          "type": "number",
          "minimum": 8,
          "maximum": 18
        },
        "pitch": {
          "type": "number",
          "minimum": 0,
          "maximum": 85
        },
        "bearing": {
          "type": "number"
        }
      }
    },
    "codes": {
      "type": "array",
      "items": {
        "type": "object",
        "required": [
          "code",
          "type"
        ],
        "additionalProperties": false,
        "properties": {
          "code": {
            "type": "string"
          },
          "type": {
            "enum": [
              "sido",
              "sigungu",
              "bjdong"
            ]
          },
          "name": {
            "type": "string"
          },
          "validFrom": {
            "type": [
              "string",
              "null"
            ],
            "format": "date"
          },
          "validTo": {
            "type": [
              "string",
              "null"
            ],
            "format": "date"
          }
        }
      }
    },
    "zones": {
      "type": "array",
      "items": {
        "type": "object",
        "required": [
          "id",
          "name",
          "type",
          "publicLand"
        ],
        "additionalProperties": false,
        "properties": {
          "id": {
            "type": "string"
          },
          "name": {
            "type": "string"
          },
          "type": {
            "enum": [
              "택지개발",
              "공공주택지구",
              "혁신도시",
              "신도시",
              "도시개발",
              "산업단지",
              "기타"
            ]
          },
          "publicLand": {
            "type": "boolean",
            "description": "공공택지(택지개발·공공주택지구·혁신도시·신도시)인지"
          },
          "poly": {
            "type": "array",
            "items": {
              "$ref": "#/$defs/lonlat"
            }
          }
        }
      }
    },
    "sources": {
      "type": "array",
      "items": {
        "type": "object",
        "required": [
          "id",
          "label",
          "redistributable"
        ],
        "additionalProperties": false,
        "properties": {
          "id": {
            "type": "string"
          },
          "label": {
            "type": "string"
          },
          "publisher": {
            "type": "string"
          },
          "license": {
            "type": "string"
          },
          "url": {
            "type": "string"
          },
          "asOf": {
            "type": [
              "string",
              "null"
            ],
            "format": "date"
          },
          "redistributable": {
            "enum": [
              "Y",
              "N",
              "unknown"
            ]
          }
        }
      }
    },
    "statusOrder": {
      "type": "array",
      "uniqueItems": true,
      "items": {
        "enum": [
          "계획",
          "분양중",
          "건설 단계",
          "준공 임박",
          "입주 단계"
        ]
      }
    },
    "projectOrder": {
      "type": "array",
      "items": {
        "type": "string"
      },
      "description": "단지 목록 표시 순서(1.1.0 추가). 단지 id 배열"
    }
  },
  "$defs": {
    "semver": {
      "type": "string",
      "pattern": "^[0-9]+\\.[0-9]+\\.[0-9]+$"
    },
    "lonlat": {
      "type": "array",
      "items": {
        "type": "number"
      },
      "minItems": 2,
      "maxItems": 2,
      "description": "[경도, 위도]"
    }
  }
}
