{"schema_version":"1.1.0","slug":"jeonnam-naju","name":"전남 나주시","title":"주택파동 · 전남 나주시","description":"광주·전남 공동혁신도시(빛가람)의 공공주택과 공공택지 위 민간 단지를 3차원 지도로 보여 줍니다.","updatedAt":"2026-10-04","view":{"center":[126.788878,35.018505],"zoom":14.5,"pitch":52,"bearing":0},"codes":[{"code":"12170","type":"sigungu","name":"나주시"},{"code":"12170134","type":"bjdong","name":"빛가람동"}],"zones":[{"id":"bitgaram","name":"광주 전남 공동혁신도시(빛가람)","type":"혁신도시","publicLand":true,"poly":[[126.766102,35.007674],[126.766789,35.007148],[126.766848,35.00712],[126.77085,35.006165],[126.807229,35.006026],[126.807431,35.006079],[126.807513,35.006102],[126.807856,35.0062],[126.807927,35.013016],[126.807656,35.014326],[126.807643,35.014378],[126.80557,35.022482],[126.804665,35.025596],[126.794921,35.036208],[126.794894,35.036226],[126.794586,35.036436],[126.79446,35.036404],[126.77917,35.03222],[126.779169,35.03222],[126.778771,35.032102],[126.778706,35.032083]]}],"sources":[{"id":"myhome-notice","label":"마이홈포털 공공주택 모집공고","publisher":"국토교통부","url":"https://www.data.go.kr/data/15108420/openapi.do","asOf":"2026-10-04","redistributable":"unknown"},{"id":"hub-housing-permit","label":"건축HUB 주택인허가","publisher":"국토교통부","url":"https://www.data.go.kr/data/15136560/openapi.do","asOf":"2026-10-04","redistributable":"unknown"},{"id":"vworld-bldginfo","label":"V-World 건물 데이터","publisher":"국토교통부 V-World","url":"https://www.vworld.kr","asOf":"2026-10-04","redistributable":"unknown"},{"id":"vworld-lhblpn","label":"V-World 블록 레이어","publisher":"국토교통부 V-World","url":"https://www.vworld.kr","asOf":"2026-10-04","redistributable":"unknown"},{"id":"vworld-cadastral","label":"V-World 연속지적도","publisher":"국토교통부 V-World","url":"https://www.vworld.kr","asOf":"2026-10-04","redistributable":"unknown"}],"statusOrder":["계획","분양중","건설 단계","준공 임박","입주 단계"]}
