{"schema_version":"1.1.0","slug":"gwangju-gwangsan","name":"광주 광산구","title":"주택파동 · 광주 광산구","description":"광주선운2 공공주택지구의 공공주택과 공공택지 위 민간 단지 공급 현황을 3차원 지도로 보여 줍니다.","updatedAt":"2026-10-04","view":{"center":[126.784763,35.148492],"zoom":15,"pitch":52,"bearing":0},"codes":[{"code":"12330","type":"sigungu","name":"광산구"},{"code":"12330106","type":"bjdong","name":"운수동"},{"code":"12330107","type":"bjdong","name":"선암동"},{"code":"12330108","type":"bjdong","name":"소촌동"}],"zones":[{"id":"sunwoon2","name":"광주선운2 공공주택지구","type":"공공주택지구","publicLand":true,"poly":[[126.78039,35.148985],[126.781124,35.148026],[126.781414,35.147693],[126.78193,35.1471],[126.782037,35.146983],[126.782664,35.146434],[126.782776,35.146338],[126.784594,35.145116],[126.789418,35.145947],[126.789395,35.146031],[126.789269,35.146474],[126.788686,35.148483],[126.788666,35.148545],[126.78857,35.148842],[126.78853,35.148949],[126.788518,35.148973],[126.788485,35.14904],[126.788453,35.149097],[126.788417,35.149151],[126.788333,35.149261],[126.788278,35.149333],[126.788185,35.149444],[126.788121,35.14952],[126.787524,35.150226],[126.787464,35.150281],[126.787407,35.150328],[126.787361,35.15036],[126.787318,35.150383],[126.787168,35.150453],[126.786979,35.15053],[126.786937,35.150546],[126.786502,35.150721],[126.786068,35.150895],[126.785206,35.151207],[126.784131,35.151583],[126.78403,35.151616],[126.783792,35.151677],[126.783628,35.151713],[126.783421,35.151755],[126.783322,35.15177],[126.783169,35.151794],[126.782951,35.151824],[126.782521,35.151878],[126.782305,35.151894],[126.781987,35.151906],[126.781886,35.151909],[126.781581,35.15191],[126.781239,35.151876],[126.780648,35.149983],[126.780533,35.149609],[126.780458,35.149343],[126.780449,35.149308]]}],"sources":[{"id":"myhome-notice","label":"마이홈포털 공공주택 모집공고","publisher":"국토교통부","url":"https://www.data.go.kr/data/15108420/openapi.do","asOf":"2026-10-04","redistributable":"unknown"},{"id":"hub-housing-permit","label":"건축HUB 주택인허가","publisher":"국토교통부","url":"https://www.data.go.kr/data/15136560/openapi.do","asOf":"2026-10-04","redistributable":"unknown"},{"id":"vworld-bldginfo","label":"V-World 건물 데이터","publisher":"국토교통부 V-World","url":"https://www.vworld.kr","asOf":"2026-10-04","redistributable":"unknown"},{"id":"vworld-lhblpn","label":"V-World 블록 레이어","publisher":"국토교통부 V-World","url":"https://www.vworld.kr","asOf":"2026-10-04","redistributable":"unknown"},{"id":"vworld-cadastral","label":"V-World 연속지적도","publisher":"국토교통부 V-World","url":"https://www.vworld.kr","asOf":"2026-10-04","redistributable":"unknown"}],"statusOrder":["계획","분양중","건설 단계","준공 임박","입주 단계"]}
